"title","description","date","link","category","content"
"Pakistan pitches ‘responsible’ image as diplomatic war with India heats up","India and Pakistan have shifted from armed confrontation to a diplomatic offensive, seeking to shape global opinion.","Published On 29 May 202529 May 2025","https://www.aljazeera.com/news/2025/5/29/ceasefire-holds-as-india-pakistan-tensions-shift-to-diplomacy","tag/india-pakistan-tensions/","Islamabad, Pakistan – Pakistan Prime Minister Shehbaz Sharif visited Azerbaijan in February, and Turkiye only a month ago, in April. Yet, this week, he was back in both countries, as part of a five-day, four-nation diplomatic blitzkrieg also including stops in Iran and Tajikistan, where Sharif will hold talks on Thursday and Friday. And he isn’t alone: Sharif is being accompanied by Army Chief Asim Munir – recently promoted to Pakistan’s only second-ever field marshal – and Deputy Prime Minister Ishaq Dar. Their destinations might be familiar, but the context has changed dramatically since Sharif’s previous visits. More than two weeks after a four-day standoff between Pakistan and India – during which they exchanged missile and drone attacks – diplomacy has become the new battlefront between the South Asian neighbours. India has launched a global diplomatic campaign, sending delegations to more than 30 countries, accusing Pakistan of supporting “terrorist groups” responsible for attacks in India and Indian-administered Kashmir. “We want to exhort the world to hold those responsible for cross-border terrorism accountable, those who have practiced this for 40 years against India, that is Pakistan. Their actions need to be called out,” said Randhir Jaiswal, spokesperson for India’s Ministry of External Affairs, last week. On April 22, gunmen killed 26 people, most of them tourists, in Pahalgam, a hill resort in Indian-administered Kashmir, in the worst such attack on civilians in years. India blamed the killings on The Resistance Front (TRF), which it alleges is linked to Lashkar-e-Taiba (LeT), a Pakistan-based group designated as a “terrorist” entity by the United Nations. New Delhi accused Islamabad of complicity in the attacks. Pakistan denied the allegations, calling for a “transparent, credible, independent” investigation. Then, on May 7, India launched a series of missiles aimed at what it said was “terrorist infrastructure” in parts of Pakistan and Pakistan-administered Kashmir. Islamabad insisted that the missiles struck civilians, mosques and schools. More than 50 people, including at least 11 security personnel, were killed in the Indian missile attacks. This was followed by drone incursions and, on May 10, both sides fired missiles at each other’s military bases, as they stood on the brink of a full-fledged war before they agreed to a ceasefire that the United States says it brokered. Now, Pakistan, say officials and analysts, is looking to flip India’s narrative before the world – projecting itself as an advocate of peace and stability in South Asia, and New Delhi as the aggressor looking to stoke tensions.  On Wednesday, Sharif expressed willingness to engage in dialogue with India on “all matters” if India reciprocates “in all sincerity”. Speaking at a trilateral summit in Lachin, Azerbaijan, Sharif said trade could resume if India cooperated on all issues, including “counterterrorism”. “I have said in all humility that we want peace in the region, and that requires talks on the table on issues which need urgent attention and amicable resolution, that is the issue of Kashmir, according to the resolutions of the United Nations and the Security Council, and as per the aspirations of the people of Kashmir,” he said. Kashmir, a picturesque valley in the northeastern subcontinent, remains the root of conflict between the two nuclear-armed nations since their independence in 1947. A 1948 UN resolution called for a plebiscite to determine Kashmir’s future, but eight decades later, it has yet to take place. India and Pakistan each administer parts of Kashmir, while China controls two small regions. India claims the entire territory; Pakistan claims the portion administered by India, but not the areas held by Pakistan’s ally, China. But there are other motivations driving Pakistan’s diplomatic outreach, say officials and experts. India’s diplomatic delegations that are currently touring the world include members from various political parties, including the ruling Bharatiya Janata Party (BJP) and the opposition Indian National Congress (INC), projecting a unified stance. In contrast, Pakistan’s current mission is led by top state officials, including Sharif and army chief Munir, widely considered the most powerful figure in the country.  The trip also reflects strategic alignment, say analysts. Turkiye, whose drones were used by Pakistan in the recent conflict, is a key defence partner. “Pakistan’s defence cooperation with Turkey is especially deep,” said Christopher Clary, assistant professor of political science at the University at Albany. “Evidence suggests several Turkish-origin systems were used in this recent clash, with varying levels of effectiveness, so there is much to talk about between the two,” he told Al Jazeera. Khurram Dastgir Khan, a former federal minister for foreign affairs and defence, is part of a Pakistani delegation set to visit the US, United Kingdom and European Union headquarters in Brussels next month. He said the current trip by Sharif, Munir and Dar is at least partly about highlighting Pakistan’s capacity to wage a modern war against a larger adversary. “There is immense interest in how Pakistan fought the recent war,” Khan said. “There are countries deeply interested in learning the details, what capabilities Pakistan used and what Indians had,” he added. “This opens new strategic possibilities for Pakistan’s defence forces to provide training to others. We are battle-tested. This makes us highly sought after, not just in the region but globally.” Pakistan relied heavily on Chinese-supplied weaponry, including the fighter jets and missiles it deployed against India, and the air defence systems it used to defend itself from Indian missiles. Though both countries claimed victory after the conflict, the battle over narratives has since raged across social media and public forums. Pakistan claims to have downed six Indian jets, a claim neither confirmed nor denied by India, while Indian missiles penetrated deep into Pakistani territory, revealing vulnerabilities in Pakistan’s air defences. India has also suspended the six-decade-old Indus Waters Treaty (IWT), a critical water-sharing agreement that is vital to Pakistan. Recently, Indian Prime Minister Narendra Modi urged Pakistanis to reject “terrorism”. “Live a life of peace, eat your bread or choose my bullet,” Modi said, during a speech in India’s Gujarat state. He also criticised the IWT as “badly negotiated”, claiming it disadvantaged India. Muhammad Shoaib, an academic and security analyst at Quaid-i-Azam University, said Modi’s remarks reflected “ultra-nationalism” and were targeted at a domestic audience. “The Indian diplomatic teams won’t likely focus on what Pakistan says. They will only implicate Pakistan for terrorism and build their case. Meanwhile, the Pakistani delegation will likely use Modi’s statements and international law regarding the IWT to bolster their arguments,” he told Al Jazeera. Khan, who is also a senior member of the Pakistan Muslim League-Nawaz (PMLN), the governing party which premier Sharif belongs to, said the upcoming diplomatic mission that he will be part of will focus on issues like India’s suspension of the IWT. “Our fundamental point is that Pakistan seeks to maintain lasting peace in South Asia, but three major hurdles are posed by Indian aggression,” he said. The first, according to Khan, is “Indian-sponsored terrorism” in Pakistan, in which, he claimed, more than 20 people have been killed over the past four years. India has been accused by the US and Canada of transnational assassinations. In January 2024, Pakistan also accused India of carrying out killings on its soil. India denies involvement. Pakistan also accuses India of backing separatist groups in its Balochistan province – again, an allegation that India rejects. “The second point is India’s utterly irresponsible suspension of the IWT,” Khan said. “Pakistan has rightly said that any step by India to stop our water will be treated as an act of war. This is something that can bring all the region in conflict and I believe that if India acquires capability to divert waters in next six to 10 years, and tries to do so, it will lead to a war,” Khan warned. The third issue, Khan said, is Pakistan’s concern over India’s “status as a responsible nuclear power”. In the past, New Delhi has frequently cited the nuclear proliferation facilitated by Abdul Qadeer Khan, the father of Pakistan’s nuclear programme, as evidence that Islamabad cannot be trusted with the safe management of its nuclear weapons. But in recent days, India’s internal security minister, Amit Shah – widely viewed as the country’s second-most powerful leader after Modi – has confirmed that India used its homegrown BrahMos missile against Pakistan during the recent military escalation. The BrahMos, developed with Russia, is a supersonic cruise missile capable of Mach 3 – three times the speed of sound – and a range of 300 to 500km (200 to 300 miles). It can carry both conventional and nuclear warheads and be launched from land, air, or sea. Khan, who served as defence minister from 2017 to 2018, warned of “unimaginable consequences” from using such weapons. “Once the missile is in the air, you cannot know what payload it carries until it hits the target. This is very, very irresponsible,” he said. “India has already shown recklessness when it mistakenly fired a missile into our territory a few years ago.” Khan was referring to an incident in March 2022, when India fired a BrahMos “accidentally” into Pakistani territory, where it fell in the densely populated city of Mian Channu, roughly 500km (300 miles) south of capital Islamabad. India at the time acknowledged that accidental launch was due to a “technical malfunction” and later sacked three air force officials. While the conflict brought both countries to the edge of war, the ceasefire declared on May 10 has held, with troops gradually returning to peacetime positions. Shoaib, also a research fellow at George Mason University in the US, expressed cautious optimism. “Initiating hostilities is risky. No side wants to be seen as irresponsible. For that to break, it would take a major incident,” he said. Tughral Yamin, a former military officer and researcher in Islamabad, noted that while diplomacy offers no guarantees, the ceasefire could last. “India has seen that Pakistan is no cakewalk. It has both conventional and nuclear deterrence,” he told Al Jazeera. “Both sides will remain alert, and Pakistan must address weaknesses exposed in the standoff.” Clary added that while the India-Pakistan relationship remains fragile, history suggests that intense clashes are often followed by calmer periods. “It is reasonable for both countries and international observers to hope for the best but prepare for the worst over the next few months,” he said. But Khan, the former minister, questioned Modi’s comments after the military crisis, where the Indian PM said any attack on the country’s soil would now be seen as worthy of a military response, and that New Delhi would cease to draw any distinction between Pakistan’s military and non-state armed groups. “The new stated policy of the Indian government is to attack Pakistan even after minor incidents, without waiting for evidence. This puts the entire region on edge,” he said. “This trigger-happy policy should concern not just Pakistan, but the entire world.”"
"Rizza in Indian-administered Kashmir","A video diary for Al Jazeera","Published On 28 May 202528 May 2025","https://www.aljazeera.com/video/on-the-ground/2025/5/28/rizza-in-indian-administered-kashmir","tag/india-pakistan-tensions/","Rizza Alee is from Indian-administered Kashmir. He takes us on a journey of his day-to-day life, and how it’s changed since May, when hostilities broke out  between India and Pakistan in Kashmir. His video diary shows the uncertainty that comes with living in a region affected by a decades-old conflict."
"How is Pakistan raising money for a 20 percent hike in defence spending?","Pakistan hikes its defence budget by 20 percent after border clashes with India, economy remains reliant on IMF loans.","Published On 12 Jun 202512 Jun 2025","https://www.aljazeera.com/news/2025/6/12/how-is-pakistan-raising-money-for-a-20-percent-hike-in-defence-spending","tag/india-pakistan-tensions/","Islamabad, Pakistan – Pakistan has increased its defence spending by more than 20 percent – the most substantial hike in a decade – following last month’s military confrontation with neighbouring India. Presenting the annual federal budget on June 10, Finance Minister Muhammad Aurangzeb proposed an allocation of 2.55 trillion rupees ($9bn) for the country’s three armed services – the army, air force and navy – amounting to 1.97 percent of Pakistan’s gross domestic product (GDP), up from 1.7 percent in the previous budget. “The security situation in the country is precarious, and the armed forces have rendered commendable service in protecting the borders,” Aurangzeb said during his speech, as India has threatened to carry out strikes if armed groups carry out attacks on India or Indian-administered Kashmir. But analysts say that Islamabad will need to walk a fine balance in spending more on defence at a time when its fragile economy is under strict oversight from the International Monetary Fund (IMF), and cuts in social sector expenditure could embolden the opposition. On May 7, India carried out missile strikes on what it called “terrorist infrastructure” in Pakistan and Pakistan-administered Kashmir after blaming Islamabad for backing fighters responsible for the killing of 26 people in Indian-administered Kashmir’s Pahalgam town on April 22. Pakistan denied involvement in the Pahalgam attacks, demanding a “credible, transparent, independent” investigation. Islamabad said innocent civilians were killed in India’s attacks on May 7. Tensions escalated after the two nuclear-armed neighbours engaged in tit-for-tat missile and drone attacks over four days, primarily targeting each other’s military installations. By the time a ceasefire was announced by United States President Donald Trump on May 10, in excess of 70 people had been killed – more than 50 in Pakistan and at least 20 in India. Against that backdrop, Pakistan’s defence hike was expected, say analysts. India, which presented its budget before the conflict, also increased its defence spending to $78.7bn, a 9.5 percent rise from the previous year. But unlike India, Pakistan has more than a neighbour to keep an eye on: It also confronts pressure from the IMF.  The IMF approved a 37-month, $7bn loan programme for Pakistan last September, its 25th since 1958. The most recent tranche of $1.3bn was released in May this year, a day before the ceasefire between India and Pakistan took place. But in exchange, the global lender has been pressuring Pakistan to streamline its expenditure, reduce subsidies and improve the efficiency of its governance structures. Pakistan appears to have paid heed to those demands from the IMF. Even as its defence spending has gone up substantially, its overall budget for the next fiscal year has been reduced to 17.57 trillion rupees ($62bn), marking a 6.9 percent decrease from last year. The defence spending hike, while massive, is in line with growing defence allocation in recent years. The military’s budget has nearly doubled in the past five years. In fiscal year 2020-21, the allocation stood at 1.28 trillion rupees ($4.53bn). The army, long seen as the most powerful institution in Pakistan’s defence and political spheres, has received 1.17 trillion rupees ($4.1bn), accounting for nearly 46 percent of the total defence budget. The air force and navy received just more than 520 billion rupees ($1.8m) and 265.9 billion rupees ($941m), respectively. Pakistan’s military budget increase also reflects a broader global trend. A report published in April by the Stockholm International Peace Research Institute (SIPRI), which specialises in conflict and arms control research, stated that global military expenditure reached $2.7 trillion in 2024, a 9.4 percent increase from the previous year and the “steepest year-on-year rise since the end of the Cold War”. Hina Shaikh, a Lahore-based economist with the International Growth Centre (IGC), said the increase in Pakistan was expected and reflects the government’s continued prioritisation of security amid geopolitical tensions and domestic instability. “While understandable from a strategic lens, this increase does come when economic recovery is just beginning to happen, but still fragile, inflation is easing and fiscal space is constrained,” she told Al Jazeera. Ali Hasanain, an economics professor at the Lahore University of Management Sciences (LUMS), called the hike in defence spending both “inevitable and necessary” but warned against sacrificing long-term development. “The only way out of this dilemma for Pakistan is to undertake deep structural reforms of the sort which no government has shown a commitment to yet, so that both the economy and defence spending can stay robust over the medium and long terms,” Hasanain said. While most analysts agree that the defence spending hike is a fallout of the May conflict, a major challenge for the government is to fund it without compromising the social welfare, health, or education sectors. Due to Pakistan’s sizable external debt, recorded at $87.4bn according to the latest government figures, the largest share of the national budget is consumed by debt servicing, which stands at $29bn, which is almost 47 percent of total expenditure. In the budget announced on Tuesday, Pakistan’s government has cut subsidies. The budget also outlines plans to expand the tax base, removes exemptions, and introduces new taxes to raise public revenue. The opposition party of jailed former Prime Minister Imran Khan dubbed the budget “anti-people” and “crafted for the elite.” The Pakistan Tehreek-e-Insaf (PTI), the opposition party said on Wednesday that the budget provided no real relief to the public, as government staff salary raises were low and agriculture, the mainstay of the country’s economy, witnessed decline. Sajid Amin Javed, a senior economist at the Sustainable Development Policy Institute (SDPI), said that the combination of a decline in the interest payments Pakistan owes its debtors this year, and the cut in subsidies had provided the government “some fiscal space”. Still, others highlighted that Pakistan’s defence spending, while the highest in South Asia as a percentage of GDP, has declined in relative terms compared to past decades as it has been forced to set money aside to repay loans. Hasanain of LUMS said that Pakistan now spends less, as a percentage of GDP, than countries like Singapore (2.8 percent), Greece (3.1 percent), Poland (4.2 percent), or the United States (3.4 percent), and nearly three times less than Saudi Arabia (7.3 percent), Russia (7.1 percent), or Israel (8.8 percent). But he pointed out that Pakistan also collects far less tax than most other countries, so the defence spending hike still eats up a giant chunk of the government’s revenue. “A low tax to GDP ratio means that defence spending is a bigger burden for the government in Pakistan than most other countries in the world.” The last few years have been deeply turbulent for Pakistan’s economy. Foreign reserves fell to just under $3bn in 2023, bringing the country of 250 million people to the brink of default. Foreign reserves have since risen to $11bn following IMF deals. Similarly, the Pakistani rupee, having lost more than 60 percent of its value against the US dollar over the last two years, has now stabilised between 280 and 282 rupees per dollar. Javed of SDPI says these indicators show Pakistan’s macroeconomic fundamentals are stabilising, but the public impact remains uncertain. “It is a budget of stabilisation, made in consultation with the IMF, to ensure that the country’s revenue, growth and fiscal deficit targets are met. But on the whole, it remains a traditional budget, with no deep-rooted structural changes or strategic change visible, at least for now,” he said. Economist Shaikh argued that the budget lacks inclusive or pro-poor reforms and shows limited investment in sectors like health and education. “This may be called a technocrat’s budget under IMF constraints, fiscally conservative, tax-heavy, and focused on short-term stabilisation. It is focused on restoring macroeconomic stability, controlling inflation, and building reserves,” she said. Hasanain, however, says that the IMF principally concerns itself with helping countries move back towards stability, and does not consider long-term, sustainable growth as its purview. “By cutting expenditures and running primary budget surpluses, the government is indeed moving out of the acute debt crisis it found itself in two years ago, but the larger project of correcting longstanding structural deficiencies is, despite receiving some lip service, largely neglected to date,” he said. “Given the lack of any serious political opposition, this excessive caution towards reform is deeply frustrating.”"
